{
  "eventId": "00000000-0000-4000-8000-000000000561",
  "eventType": "identity.user_employment_returned",
  "eventVersion": 1,
  "occurredAt": "2026-08-14T05:15:00Z",
  "aggregateType": "User",
  "aggregateId": "00000000-0000-4000-8000-000000000562",
  "aggregateVersion": 7,
  "companyId": "00000000-0000-4000-8000-000000000563",
  "actor": { "type": "SYSTEM", "systemCode": "DIRECTORY_SYNC" },
  "requestId": "m105-returned-example",
  "correlationId": "m105-returned-example",
  "causationId": null,
  "payload": {
    "userId": "00000000-0000-4000-8000-000000000562",
    "runId": "00000000-0000-4000-8000-000000000564",
    "fromStatus": "LEFT",
    "toStatus": "ACTIVE",
    "reasonCode": "DIRECTORY_MEMBER_REAPPEARED",
    "authorizationVersion": 2
  }
}
