{
  "eventId": "48000000-0000-4000-8000-000000000081",
  "eventType": "workitem.work_item_unarchived",
  "eventVersion": 1,
  "occurredAt": "2026-09-02T10:04:00Z",
  "aggregateType": "WorkItem",
  "aggregateId": "48000000-0000-4000-8000-000000000002",
  "aggregateVersion": 4,
  "companyId": "48000000-0000-4000-8000-000000000003",
  "actor": {
    "type": "USER",
    "userId": "48000000-0000-4000-8000-000000000004"
  },
  "requestId": "restore-v2",
  "correlationId": "restore-v2",
  "causationId": null,
  "payload": {
    "workItemId": "48000000-0000-4000-8000-000000000002",
    "projectId": "48000000-0000-4000-8000-000000000005",
    "contentId": "48000000-0000-4000-8000-000000000007",
    "itemNo": "PROJECT-1",
    "title": "类别化工作项",
    "statusCode": "DOING",
    "statusCategory": "IN_PROGRESS",
    "priority": null,
    "rowVersion": 4,
    "archived": false
  }
}
