{"eventId":"27000000-0000-4000-8000-000000000021","eventType":"catalog.project_product_link_updated","eventVersion":1,"occurredAt":"2026-08-21T12:01:00Z","aggregateType":"ProjectProductLink","aggregateId":"27000000-0000-4000-8000-000000000022","aggregateVersion":1,"companyId":"00000000-0000-4000-8000-000000000001","actor":{"type":"USER","userId":"27000000-0000-4000-8000-000000000023"},"requestId":"m2-07-updated","correlationId":"m2-07-updated","causationId":null,"payload":{"linkId":"27000000-0000-4000-8000-000000000022","projectId":"27000000-0000-4000-8000-000000000024","productId":"27000000-0000-4000-8000-000000000025","relationType":"DELIVERY","fromPrimary":false,"toPrimary":true}}
