{"eventId":"27000000-0000-4000-8000-000000000001","eventType":"catalog.product_linked_to_project","eventVersion":1,"occurredAt":"2026-08-21T12:00:00Z","aggregateType":"ProjectProductLink","aggregateId":"27000000-0000-4000-8000-000000000002","aggregateVersion":0,"companyId":"00000000-0000-4000-8000-000000000001","actor":{"type":"USER","userId":"27000000-0000-4000-8000-000000000003"},"requestId":"m2-07-linked","correlationId":"m2-07-linked","causationId":null,"payload":{"linkId":"27000000-0000-4000-8000-000000000002","projectId":"27000000-0000-4000-8000-000000000004","productId":"27000000-0000-4000-8000-000000000005","relationType":"DEVELOPMENT","isPrimary":true}}
