{
  "eventId": "24000000-0000-4000-8000-000000000001",
  "eventType": "catalog.project_created",
  "eventVersion": 2,
  "occurredAt": "2026-08-20T10:00:00Z",
  "aggregateType": "Project",
  "aggregateId": "24000000-0000-4000-8000-000000000002",
  "aggregateVersion": 0,
  "companyId": "00000000-0000-4000-8000-000000000001",
  "actor": {
    "type": "USER",
    "userId": "24000000-0000-4000-8000-000000000003"
  },
  "requestId": "m2-04-project-create",
  "correlationId": "m2-04-project-create",
  "causationId": null,
  "payload": {
    "projectId": "24000000-0000-4000-8000-000000000002",
    "workspaceId": "24000000-0000-4000-8000-000000000004",
    "code": "P001",
    "name": "Yumpoo 产品研发",
    "lifecycle": "ACTIVE",
    "ownerUserId": "24000000-0000-4000-8000-000000000005",
    "initializedContentCount": 3
  }
}
