{
  "eventId": "23000000-0000-4000-8000-000000000031", "eventType": "catalog.product_archived", "eventVersion": 1,
  "occurredAt": "2026-08-20T09:20:00Z", "aggregateType": "Product", "aggregateId": "23000000-0000-4000-8000-000000000002", "aggregateVersion": 2,
  "companyId": "00000000-0000-4000-8000-000000000001", "actor": { "type": "USER", "userId": "23000000-0000-4000-8000-000000000004" },
  "requestId": "m2-03-product-archive", "correlationId": "m2-03-product-archive", "causationId": null,
  "payload": { "productId": "23000000-0000-4000-8000-000000000002", "code": "YUMPOO", "name": "Yumpoo", "status": "ARCHIVED", "ownerUserId": "23000000-0000-4000-8000-000000000004", "fromStatus": "ACTIVE", "toStatus": "ARCHIVED" }
}
