{
  "eventId": "49000000-0000-4000-8000-000000000013",
  "eventType": "catalog.project_purged",
  "eventVersion": 1,
  "occurredAt": "2026-11-08T12:00:00Z",
  "aggregateType": "Project",
  "aggregateId": "49000000-0000-4000-8000-000000000002",
  "aggregateVersion": 4,
  "companyId": "00000000-0000-4000-8000-000000000001",
  "actor": {
    "type": "SYSTEM",
    "systemCode": "PROJECT_PURGER"
  },
  "requestId": "up11-project-deletion",
  "correlationId": "up11-project-deletion",
  "causationId": null,
  "payload": {
    "projectId": "49000000-0000-4000-8000-000000000002",
    "purgedAt": "2026-11-08T12:00:00Z"
  }
}
