{"eventId":"48000000-0000-4000-8000-000000000061","eventType":"workitem.work_item_deleted","eventVersion":2,"occurredAt":"2026-09-02T10:03:00Z","aggregateType":"WorkItem","aggregateId":"48000000-0000-4000-8000-000000000002","aggregateVersion":3,"companyId":"48000000-0000-4000-8000-000000000003","actor":{"type":"USER","userId":"48000000-0000-4000-8000-000000000004"},"requestId":"delete-v2","correlationId":"delete-v2","causationId":null,"payload":{"workItemId":"48000000-0000-4000-8000-000000000002","projectId":"48000000-0000-4000-8000-000000000005","contentId":"48000000-0000-4000-8000-000000000007","itemNo":"PROJECT-1","title":"类别化工作项","statusCode":"DOING","statusCategory":"IN_PROGRESS","priority":null,"rowVersion":3,"deletedAt":"2026-09-02T10:03:00Z","deletedByUserId":"48000000-0000-4000-8000-000000000004","deleteReason":"清理测试工作项"}}
